{
  "id": "HYP-0001",
  "schema_version": "0.1",
  "created_at": "2026-09-26T00:00:00Z",
  "created_by": "orchestrator",
  "asset": "<MÃ>",
  "thesis": "<luận điểm>",
  "catalyst": "<chất xúc tác>",
  "time_horizon": "12 tháng",
  "expected_effect": "<kỳ vọng>",
  "conditions_if": [
    "tăng trưởng doanh thu > X",
    "biên lợi nhuận mở rộng",
    "định giá < Y"
  ],
  "expectation_then": "lợi nhuận kỳ vọng có thể > Z",
  "invalidation_unless": [
    "cạnh tranh tăng tốc",
    "regime vĩ mô thay đổi"
  ],
  "assumptions": [],
  "risks": [],
  "invalidation_conditions": [
    "biên gộp giảm 2 quý liên tiếp"
  ],
  "confidence": {
    "value": 0.5,
    "basis": "chưa có bằng chứng"
  },
  "evidence_refs": [],
  "status": "DRAFT",
  "deployment_level": 0
}
